Name,Slot,Cost,Type,Elements,Prerequisites,Max Replicates,Double-Edged,Short,Description,Tags
bounty hunter,trinket,1,advanced,,,1,No,You are an expert at finding creatures.,"Add your aptitude bonus to all skill checks made to locate, track or research other creatures, even if you are already trained in the appropriate skill.",
relic hunter,trinket,1,advanced,,,1,No,You are an expert at finding objects.,"Add your aptitude bonus to all skill checks made to locate, track or research items, even if you are already trained in the appropriate skill.",
ruin hunter,trinket,1,advanced,,,1,No,You are an expert at finding places.,"Add your aptitude bonus to all skill checks made to locate, explore or research places, even if you are already trained in the appropriate skill.",
affluent crafter,trinket,1,exotic,,,1,Yes,You are better at crafting but it costs more.,"You have advantage on all crafting skill checks, but they use twice as many resources.",crafting
careful crafter,trinket,1,exotic,,,1,Yes,You are better at crafting but it takes longer.,"You have advantage on all crafting skill checks, but they take twice as long.",crafting
lair,trinket,1,exotic,,,1,No,You are more efficient and harder to surprise while in your lair.,"After you complete a natural rest in a defensible area, you may designate it as your lair. While in your lair, you may gain the benefit of two downtime activities each time you complete a natural rest, rather than the usual one and have advantage on all Perception skill checks. You may only have one lair at a time.",downtime
born to fly,trinket,-2,advanced,,,1,No,You are nearly useless when not flying.,"While you are not flying, your basic attacks have disadvantage, and all basic attacks against you have advantage.",flying
graceless flier,trinket,-1,advanced,,,1,No,You can barely fly.,You automatically land at the end of each of your turns.,flying
climbing,trinket,1,advanced,,,1,No,You can climb expertly.,You can climb freely on walls and ceilings at the same speed as you normally could. You drop to the ground if you suffer forced movement.,movement
hurried crafter,trinket,1,exotic,,,1,Yes,You can craft quickly but it takese more resources.,Your crafting skill checks take half as long but use twice as many resources.,crafting
inventive crafter,trinket,1,advanced,,,1,No,You can learn and invent affixes more easily.,"You have advantage on all skill checks made to learn new affixes, and inventing affixes no longer costs you essence crystals.",crafting
scent,trinket,1,advanced,,,1,No,You can smell nearby creatures.,"You can detect nearby creatures by scent using a Focus (Perception) check. You can detect all creatures within 5 times your skill check result feet this way. If you have smelled the creature (or the creature’s clothing) before, you can identify it by smell.",senses
resolute,trinket,1,advanced,,,0,No,You can store more Resolve at once.,The maximum amount of Resolve that the party can store at once is increased by 2.,resolve
endless,trinket,1,advanced,,,1,No,You have an unending supply of this mundane item.,"You never seem to run out of this mundane item. Every time you complete a rest with 5 or fewer copies of this item in your possession, you end up with 1d4 more ready to use.",gizmo
bell curve,trinket,1,advanced,,,1,No,Your skill checks are more reliable.,"Rather than rolling a d20 when making skill checks, roll two d10s, adding the first d10 to 10, and then subtracting the second d10.",luck
amorphous,trinket,1,advanced,,,1,No,You may pass through gaps as small as one inch wide.,You may pass through gaps as small as one inch wide.,
holding,trinket,1,advanced,,,0,No,You may carry 10 additional inventory slots of items.,You may carry 10 additional inventory slots of items.,
sharing,trinket,1,exotic,,,1,No,You can grant your trinkets' benefits to nearby creatures.,"Once per rest, you may apply any of your trinkets' benefits to any creature you can see within 30 feet rather than yourself. If the target is unwilling, you must hit them a Focus attack in order to use this feature.",
skill monkey,trinket,2,advanced,,,1,No,You are half-decent at untrained skills.,You may apply half your aptitude bonus to skill checks for skills you are not trained in.,
remote,trinket,1,advanced,,,0,No,You may activate this trinket at a distance.,You may activate this trinket while up to 60 feet away from it.,
appraising,trinket,1,exotic,,,1,No,You know the value of things.,"You immediately know the true value of any object you inspect, although do not necessarily know why it has that value.",
mending,trinket,1,advanced,,,1,No,You can repair objects as if by magic.,"You have advantage on all Craftsmanship skill checks to repair mundane items and perform their repairs 10 times as quickly, without the use of new materials.",
mockingbird,trinket,1,exotic,,,1,No,You can mimic sounds.,You can perfectly mimic any sound you've heard while you have been benefiting from this affix.,
flying,trinket,2,advanced,,,1,No,You can fly.,You can fly.,
dosimetry,trinket,1,exotic,,,1,No,You can detect magical energy.,"You can detect magical energy by series of increasingly quick flashes of light or beeps of this item. When pointed at a magical item, you automatically learn its enchantment point total.",
silent,trinket,1,exotic,,,1,Yes,You are always silent.,You are completely silent; even when you might wish otherwise.,
reliable,trinket,1,advanced,,,0,Yes,Average your skill check results.,"Whenever you roll a skill check, roll twice instead and use the average of the results.",
lucky charm,trinket,1,advanced,,,1,No,Reroll 1s on skill checks.,"Whenever you roll a 1 when making a skill check, reroll the die. You must use the new result.",
swingy skill,trinket,2,exotic,,,1,Yes,Disadvantage and advantage on skill checks is more impactful.,"Whenever you have advantage or disadvantage on a skill check, roll three dice instead of two.",
decoder ring,trinket,1,exotic,,,0,No,Translate writing to and from a secret language that no one else knows.,You may spend one minute to translate any piece of writing to or from a secret language. Decoding this language requires a difficulty 25 Expertise (Insight) skill check as a downtime activity.,
oxygenation,trinket,1,exotic,air,,1,No,This item produces a supply of clean air.,"This object produces an endless supply of fresh, breatheable air that can be shared between up to 6 tiles worth of creatures.",
revealing,trinket,2,advanced,,,1,Yes,The light cast by this object reveals the unseen.,The light cast by this object reveals invisibility and gives you advantage on all Perception and Insight skill checks using sight.,
unphased,trinket,1,exotic,,,1,No,You are unphased by the circumstances of your skill checks.,Roll one d20 when making skill checks even when you have advantage or disadvantage.,
olfactory,trinket,1,exotic,,,1,No,This item can produces smells of your choice.,"As a minor action, you can cause this object to smell like anything you might wish. You can vary the radius at which the scent can be detected, up to a maxiumum of 300 feet.",
misfortune,trinket,1,advanced,,,0,No,Interfere with others skill checks.,"Once per rest you may cause the results of a skill check made by another creature to be treated as if they had rolled a 5, as if you had spent Resolve.",
handy conjuring,trinket,2,advanced,,,1,No,You can produce useful things.,"Once per rest as a minor action, you may produce any mundane item that you can comfortably hold that does not have significant value or contain unknown information.",
wardrobe,trinket,1,advanced,,,1,No,"You can change the appearance of your arms, armor and clothing.","Once per rest as a minor action, you may permanently change the appearance of any arms, armor or clothing you are holding or wearing. These changes are purely cosmetic.",
reconfiguration,trinket,1,advanced,,,1,No,You can change the appearance of objects.,"Once per rest as a minor action, you may permanently change the appearance of an object you are holding. It must remain the same basic type, maintain the same functionality and have the same approximate value.",
fortune,trinket,1,advanced,,,0,No,Help others with their skill checks.,"Once per rest you may cause the results of a skill check made by another creature to be treated as if they had rolled a 15, as if you had spent Resolve.",
nocturnal vision,trinket,1,exotic,umbral,,1,Yes,"Easily see in darkness, cannot see in light",The effects of light and darkness are swapped for you.,
professionalism,trinket,1,advanced,,,0,No,NPCs are willing to work with you even if they don't like you.,"NPCs with negative loyalty to you evaluate deals as if their loyalty was one higher, to a maximum of 0.",
scamming,trinket,1,advanced,,,0,No,NPCs find your deals more plausible.,"NPCs treat the plausibility of deals you propose as if it were one higher than they normally would. As usual, this cannot increase the modifier above +2.",
icebox,trinket,1,exotic,,,1,No,Keeps items hot or cold.,This object keeps objects or fluids stored in at at a perfectly constant temperature.,
unlocking,trinket,1,advanced,,,1,No,Become better at lockpicking.,"Gain advantage on any Tinkering or Arcana checks made to unlock or undo seals, locks or the like.",
linguist,trinket,1,advanced,,,1,No,Become better at communicating in new languages.,Gain advantage on any checks to understand or commmunicate in a language you do not know.,
expert,trinket,2,advanced,,,0,No,Increase your aptitiude in a skill of your choice.,"Choose a skill. Add your aptitude bonus to all skill checks made with it, even if you are already trained in it.",
item bond,trinket,1,advanced,,,1,No,You cannot lose this item.,You cannot lose this item.,
meets expectations,trinket,3,prismatic,,,1,No,You can take 10 on skill checks.,"Before you roll to make a skill check, you may choose to use 10 + your skill bonus in place of your normal results.",
alerting,trinket,1,exotic,,,1,Yes,Communicate information loudly.,"As a minor action, you may create a very loud noise, communicating rough information to all allies within 300 feet of you.",
sharing,trinket,1,advanced,,,1,No,Broadcast the benefits of this trinket to allies,"Once per rest as a minor action, you may choose to grant up to 8 creatures of your choice the benefits of any trinket of your choice for 1 minute.",
remote control,trinket,1,advanced,,,1,No,You can move the object remotely,"As a minor action while this object is within 300 feet of you, you may cause it to move up to 30 feet along the ground. You do not gain any special awareness of this object's state or surroundings.",
cleaning,trinket,1,exotic,,,1,No,Magically clean objects,"As a major action, you can magically clean any object that fits within a 10 foot cube.",
paper crane,trinket,1,advanced,,,1,No,Squeeze through tight spaces more easily,You have advantage on skill checks made to move through or work in tight corridors.,
locking,trinket,1,advanced,,,0,No,Magically lock things.,"You can magically lock doors chests or so on with this object, requiring an appropriate difficulty 25 skill check to unlock, destroy or otherwise bypass.",
undying,trinket,1,prismatic,,,1,Yes,Automatically resurrect into your previous body.,"While dead, if your corpse is still wearing this item, whenever your party completes a rest, roll a d20. If the result is 11 or higher, your soul returns to your corpse and you are resurrected. You can no longer become a spirit.",downtime
prophecy,trinket,1,prismatic,,,1,No,Divine the future as a downtime activity.,"As a downtime activity, you may make a difficulty 25 Focus (Insight) skill check attempting to see the future. If you succeed, the worldspeaker tells you the next major plot twist that they had planned, and unless the party deliberately subverts it, they must follow through with that plan.",divination
enforced progress,trinket,1,prismatic,,,1,Yes,Double your essence crystals every rest.,"Whenever you complete a rest, the number of essence crystals the party has doubles.",crafting
dead tired,trinket,1,prismatic,,,1,No,Exhaustion can only kill you.,You no longer suffer any effects from exhaustion other than death.,exhaustion
ceaseless,armor,1,prismatic,,,1,No,Exhaustion does nothing to you.,You ignore all effects of exhaustion except death.,exhaustion
recovery,trinket,1,prismatic,,,1,No,Get Resolve as a downtime activity.,"As a downtime activity, gain a Resolve.",downtime
hunting,trinket,1,prismatic,,,1,Yes,Learn the way to something specific that you are seeking as a downtime activity.,"As a downtime activity, you may make a difficulty 25 Focus (Insight) skill check attempting to locate a specific object, creature, or location of your choice. If you succeed, you know their location relative to you until you complete a rest, although they also know your identity and relative location as well. If you targeted an object, its holder (or owner, if it is not being held) learns this instead.",divination
enforced liberty,trinket,1,prismatic,,,1,Yes,Locks and restraints near you simply do not work.,"Restraints, locks, traps and so on within 300 feet of you refuse to function.",gizmo
extraordinarily efficient,trinket,1,prismatic,,,1,No,Make Endurance checks to keep doing more downtime activities.,"Every time you complete a downtime activity, make a difficulty 20 Focus (Endurance) skill check. If you succeed, you may pursue another downtime activity, and may gain this effect again.",downtime
enforced integrity,trinket,1,prismatic,,,1,Yes,No one can lie near you.,"Creatures, including yourself, cannot lie in your presence.",social
extreme resolve,trinket,1,prismatic,,,1,No,Resolve sets rolls to 1 or 20.,"Whenever your party spends Resolve to modify the results of a skill check, the die is set to 1 or 20, rather than 5 or 15 like usual.",resolve
enforced harmony,trinket,1,prismatic,,,1,Yes,Things repair themselves after you complete a rest.,"Whenever you complete a rest, you find that the environment within 300 feet of you (objects, structures, nature) is fully repaired and in good working order.",downtime
phylactery,trinket,1,prismatic,,,1,Yes,You are automatically resurrected at this object.,"You can no longer be resurrected by ordinary means or become a spirit. Instead, you reincarnate in your original form 1d4 days later at this object.",resurrection
immortality,trinket,1,prismatic,,,1,No,You do not gain Transcendence automatically while dead.,"While dead, you do not accumulate Transcendence when the party completes a rest like usual.",downtime
enforced equality,trinket,1,prismatic,,,1,Yes,Your party's life and exhaustion are shared after resting.,"After you complete a rest, your party's exhaustion and current life are redistributed between the party members as evenly as possible.",downtime
overly specialized,trinket,1,prismatic,,,1,Yes,"You are very good at the things you know, and terrible at everything else.","You no longer roll skill checks. You automatically treat skill checks for the skills you are trained in as if you had rolled a 15, and skill checks for skills you are not trained in as if you had rolled a 5.",
limitless,trinket,1,prismatic,,,1,No,You may use activated trinket abilities as frequently as you want.,You may use the activated abilities of trinkets as frequently as you wish.,
universal knowledge,trinket,1,prismatic,,,1,No,You are trained in all skills.,You are trained in all skills.,
brainwashing,trinket,1,prismatic,,,1,Yes,Loyalty you have one is more effective but you cannot call in favors.,The effects of loyalty on motivation are doubled but you can no longer call in favors.,
consistent skill,trinket,1,prismatic,,,1,Yes,Your skill checks are consistently good.,Roll 3d6 + 2 rather than a d20 for your skill checks.,
conformity,trinket,1,prismatic,,,1,Yes,NPCs act as if they perfectly match your ideals.,NPCs evaluate the morality of deals that you attempt to make with them as if they perfectly matched your Ideals.,
shifting ties,trinket,1,prismatic,,,1,Yes,NPC loyalty swings back and forth more easily.,"All loyalty gains and losses are doubled, other than loyalty lost due to calling in a favor.",
